Authors,Author(s) ID,Title,Year,Source title,Volume,Issue,Art. No.,Page start,Page end,Page count,Cited by,DOI,Link,Document Type,Publication Stage,Open Access,Source,EID
"De Prado, A.G., Ortiz, G., Boubeta-Puig, J.","35084923300;8886085000;47061180200;","CARED-SOA: A Context-Aware Event-Driven Service-Oriented Architecture",2017,"IEEE Access","5",,"7874075","4646","4663",,21,"10.1109/ACCESS.2017.2679338","https://www.scopus.com/inward/record.uri?eid=2-s2.0-85018982965&doi=10.1109%2fACCESS.2017.2679338&partnerID=40&md5=b22b8d8c3c2078b7d0fbc6bc56c86767",Article,"Final","All Open Access, Gold",Scopus,2-s2.0-85018982965
"Wang, M., Bandara, K.Y., Pahl, C.","35085431700;57188850914;55049859200;","A distributed architecture for policy-customisable multi-tenant processes-as-a-service",2016,"International Journal of Parallel, Emergent and Distributed Systems","31","4",,"377","404",,,"10.1080/17445760.2015.1058940","https://www.scopus.com/inward/record.uri?eid=2-s2.0-84937132072&doi=10.1080%2f17445760.2015.1058940&partnerID=40&md5=7fc3ce9a8a38d2b934e3f07e7efb39d0",Article,"Final","All Open Access, Green",Scopus,2-s2.0-84937132072
"Mourad, A., Tout, H., Talhi, C., Otrok, H., Yahyaoui, H.","9275987400;55442989700;9275987500;20436645500;6602992340;","From model-driven specification to design-level set-based analysis of XACML policies",2016,"Computers and Electrical Engineering","52",,,"65","79",,9,"10.1016/j.compeleceng.2015.09.021","https://www.scopus.com/inward/record.uri?eid=2-s2.0-84952845717&doi=10.1016%2fj.compeleceng.2015.09.021&partnerID=40&md5=d6b73d908a6bcb37bb48328747c54ae1",Article,"Final","",Scopus,2-s2.0-84952845717
"Tout, H., Mourad, A., Talhi, C., Otrok, H.","55442989700;9275987400;9275987500;20436645500;","AOMD approach for context-adaptable and conflict-free Web services composition",2015,"Computers and Electrical Engineering","44",,,"200","217",,11,"10.1016/j.compeleceng.2015.04.004","https://www.scopus.com/inward/record.uri?eid=2-s2.0-84931005951&doi=10.1016%2fj.compeleceng.2015.04.004&partnerID=40&md5=22dfbf31687443920813dba7c9488131",Article,"Final","",Scopus,2-s2.0-84931005951
"Jebbaoui, H., Mourad, A., Otrok, H., Haraty, R.","56338299100;9275987400;20436645500;6602296150;","Semantics-based approach for detecting flaws, conflicts and redundancies in XACML policies",2015,"Computers and Electrical Engineering","44",,,"91","103",,20,"10.1016/j.compeleceng.2014.12.012","https://www.scopus.com/inward/record.uri?eid=2-s2.0-84931004445&doi=10.1016%2fj.compeleceng.2014.12.012&partnerID=40&md5=94746a0b7f73774e0a094fac546eb0ca",Article,"Final","",Scopus,2-s2.0-84931004445
"Ortiz, G., Peinado, S., de Prado, A.G., Boubeta-Puig, J.","8886085000;56527052900;35084923300;47061180200;","MoDAS: Methodology and tool for model-driven adaptable services",2015,"Lecture Notes in Computer Science (including subseries Lecture Notes in Artificial Intelligence and Lecture Notes in Bioinformatics)","8954",,,"32","43",,,"10.1007/978-3-319-22885-3_4","https://www.scopus.com/inward/record.uri?eid=2-s2.0-84983591344&doi=10.1007%2f978-3-319-22885-3_4&partnerID=40&md5=70b95aaf53128082da67bc65c7c6ade3",Conference Paper,"Final","",Scopus,2-s2.0-84983591344
"Mourad, A., Jebbaoui, H.","9275987400;56338299100;","SBA-XACML: Set-based approach providing efficient policy decision process for accessing Web services",2015,"Expert Systems with Applications","42","1",,"165","178",,24,"10.1016/j.eswa.2014.07.031","https://www.scopus.com/inward/record.uri?eid=2-s2.0-84906536414&doi=10.1016%2fj.eswa.2014.07.031&partnerID=40&md5=f8dc2ba8be8cc5054c7baa9860d00760",Article,"Final","",Scopus,2-s2.0-84906536414
"González, L., Ortiz, G.","55605778813;8886085000;","An event-driven integration platform for context-aware web services",2014,"Journal of Universal Computer Science","20","8",,"1071","1088",,6,,"https://www.scopus.com/inward/record.uri?eid=2-s2.0-84907963365&partnerID=40&md5=13acbe60eb03dd049f94a166d1fe3d57",Article,"Final","",Scopus,2-s2.0-84907963365
"González, L., Ortiz, G.","55605778813;8886085000;","An ESB-Based Infrastructure for Event-Driven Context-Aware Web Services",2013,"Communications in Computer and Information Science","393 CCIS",,,"360","369",,3,"10.1007/978-3-642-45364-9_29","https://www.scopus.com/inward/record.uri?eid=2-s2.0-84904648324&doi=10.1007%2f978-3-642-45364-9_29&partnerID=40&md5=ffc3599473489d1fdb9680b97ce2c46d",Conference Paper,"Final","",Scopus,2-s2.0-84904648324
