Authors,Author(s) ID,Title,Year,Source title,Volume,Issue,Art. No.,Page start,Page end,Page count,Cited by,DOI,Link,Document Type,Publication Stage,Open Access,Source,EID
"Aldahwan, N.S., Ramzan, M.S.","57205286954;57299936600;","Factors Affecting the Organizational Adoption of Secure Community Cloud in KSA",2021,"Security and Communication Networks","2021",,"8134739","","",,,"10.1155/2021/8134739","https://www.scopus.com/inward/record.uri?eid=2-s2.0-85117265257&doi=10.1155%2f2021%2f8134739&partnerID=40&md5=ac052f9acae3bcc4097eabb8280f97a6",Article,"Final","All Open Access, Gold",Scopus,2-s2.0-85117265257
"Abusitta, A., Bellaiche, M., Dagenais, M.","22933740900;25031178700;7102288193;","An SVM-based framework for detecting DoS attacks in virtualized clouds under changing environment",2018,"Journal of Cloud Computing","7","1","9","","",,23,"10.1186/s13677-018-0109-4","https://www.scopus.com/inward/record.uri?eid=2-s2.0-85045509330&doi=10.1186%2fs13677-018-0109-4&partnerID=40&md5=48d22d51fb907a845d8d247ae055d4e3",Article,"Final","All Open Access, Gold, Green",Scopus,2-s2.0-85045509330
"Wahab, O.A., Bentahar, J., Otrok, H., Mourad, A.","55798635800;8961304900;20436645500;9275987400;","Towards Trustworthy Multi-Cloud Services Communities: A Trust-Based Hedonic Coalitional Game",2018,"IEEE Transactions on Services Computing","11","1","7445255","184","201",,56,"10.1109/TSC.2016.2549019","https://www.scopus.com/inward/record.uri?eid=2-s2.0-85042018726&doi=10.1109%2fTSC.2016.2549019&partnerID=40&md5=2f0a7adf7ffba904d17fea0ab18b3a68",Article,"Final","",Scopus,2-s2.0-85042018726
"Das, M.S., Govardhan, A., Lakshmi, D.V.","57194027499;26326827400;57191277280;","An approach for improving performance of Web services and cloud based applications",2016,"Proceedings - 2016 International Conference on Engineering and MIS, ICEMIS 2016",,,"7745348","","",,1,"10.1109/ICEMIS.2016.7745348","https://www.scopus.com/inward/record.uri?eid=2-s2.0-85002825353&doi=10.1109%2fICEMIS.2016.7745348&partnerID=40&md5=33ccc98546e311c60b3e28a66fc5a8c9",Conference Paper,"Final","",Scopus,2-s2.0-85002825353
"Wahab, O.A., Bentahar, J., Otrok, H., Mourad, A.","55798635800;8961304900;20436645500;9275987400;","How to distribute the detection load among virtual machines to maximize the detection of distributed attacks in the cloud?",2016,"Proceedings - 2016 IEEE International Conference on Services Computing, SCC 2016",,,"7557468","316","323",,9,"10.1109/SCC.2016.48","https://www.scopus.com/inward/record.uri?eid=2-s2.0-84989829639&doi=10.1109%2fSCC.2016.48&partnerID=40&md5=129a56e0e2c27a9960879089e580e0ec",Conference Paper,"Final","",Scopus,2-s2.0-84989829639
