Authors,Author(s) ID,Title,Year,Source title,Volume,Issue,Art. No.,Page start,Page end,Page count,Cited by,DOI,Link,Document Type,Publication Stage,Open Access,Source,EID
"Hammoud, A., Otrok, H., Mourad, A., Dziong, Z.","57196650892;20436645500;9275987400;6603795154;","Stable federated fog formation: An evolutionary game theoretical approach",2021,"Future Generation Computer Systems","124",,,"21","32",,,"10.1016/j.future.2021.05.021","https://www.scopus.com/inward/record.uri?eid=2-s2.0-85107019507&doi=10.1016%2fj.future.2021.05.021&partnerID=40&md5=ddcca67272d51868a709a2b631d2d5d7",Article,"Final","",Scopus,2-s2.0-85107019507
"Sami, H., Otrok, H., Bentahar, J., Mourad, A.","57211430573;20436645500;8961304900;9275987400;","AI-Based Resource Provisioning of IoE Services in 6G: A Deep Reinforcement Learning Approach",2021,"IEEE Transactions on Network and Service Management","18","3","9380677","3527","3540",,2,"10.1109/TNSM.2021.3066625","https://www.scopus.com/inward/record.uri?eid=2-s2.0-85103212239&doi=10.1109%2fTNSM.2021.3066625&partnerID=40&md5=8022c846785a944692e9ae79c5429fd6",Article,"Final","",Scopus,2-s2.0-85103212239
"Nayeri, Z.M., Ghafarian, T., Javadi, B.","57223033953;35179399200;6507235083;","Application placement in Fog computing with AI approach: Taxonomy and a state of the art survey",2021,"Journal of Network and Computer Applications","185",,"103078","","",,5,"10.1016/j.jnca.2021.103078","https://www.scopus.com/inward/record.uri?eid=2-s2.0-85104640883&doi=10.1016%2fj.jnca.2021.103078&partnerID=40&md5=7b63d268989c55b8a783b826b0d79bf2",Review,"Final","",Scopus,2-s2.0-85104640883
"Mahmud, R., Ramamohanarao, K., Buyya, R.","57200419245;57201696320;57194845546;","Application Management in Fog Computing Environments: A Taxonomy, Review and Future Directions",2020,"ACM Computing Surveys","53","4","3403955","","",,29,"10.1145/3403955","https://www.scopus.com/inward/record.uri?eid=2-s2.0-85090599166&doi=10.1145%2f3403955&partnerID=40&md5=6865a729fe48c1c3c18f2bc317f7950e",Review,"Final","All Open Access, Green",Scopus,2-s2.0-85090599166
"Narayana, P., Parvataneni, P., Keerthi, K.","57216899273;57216898312;57216897402;","A Research on Various Scheduling Strategies in Fog Computing Environment",2020,"International Conference on Emerging Trends in Information Technology and Engineering, ic-ETITE 2020",,,"9077724","","",,,"10.1109/ic-ETITE47903.2020.261","https://www.scopus.com/inward/record.uri?eid=2-s2.0-85085191921&doi=10.1109%2fic-ETITE47903.2020.261&partnerID=40&md5=8bbd7d2276d12bb8a58ef814ca931e3e",Conference Paper,"Final","",Scopus,2-s2.0-85085191921
"Yan, X., Xu, X., Zheng, Y., Dai, F.","57220178763;55706201200;57193548640;55434920100;","Fog Server Placement for Multimodality Data Fusion in Neuroimaging",2020,"Lecture Notes in Computer Science (including subseries Lecture Notes in Artificial Intelligence and Lecture Notes in Bioinformatics)","12486 LNCS",,,"234","248",,,"10.1007/978-3-030-62223-7_20","https://www.scopus.com/inward/record.uri?eid=2-s2.0-85097127527&doi=10.1007%2f978-3-030-62223-7_20&partnerID=40&md5=772ba9f57dae63305ff6e1a6f85ae2e0",Conference Paper,"Final","",Scopus,2-s2.0-85097127527
"Tay, B., Mourad, A.","57218880756;9275987400;","Intelligent Performance-Aware Adaptation of Control Policies for Optimizing Banking Teller Process Using Machine Learning",2020,"IEEE Access","8",,"9163345","153403","153412",,2,"10.1109/ACCESS.2020.3015616","https://www.scopus.com/inward/record.uri?eid=2-s2.0-85090546587&doi=10.1109%2fACCESS.2020.3015616&partnerID=40&md5=c542e8951cb8fc8789b874cf28b1ae2e",Article,"Final","All Open Access, Gold",Scopus,2-s2.0-85090546587
