Cites,Authors,Title,Year,Source,Publisher,ArticleURL,CitesURL,GSRank,QueryDate,Type,DOI,ISSN,CitationURL,Volume,Issue,StartPage,EndPage,ECC,CitesPerYear,CitesPerAuthor,AuthorCount,Age,Abstract,FullTextURL,RelatedURL
253,"F Sakiz, S Sen","A survey of attacks and detection mechanisms on intelligent transportation systems: VANETs and IoV",2017,"Ad Hoc Networks","Elsevier","https://www.sciencedirect.com/science/article/pii/S1570870517300562","https://scholar.google.com/scholar?cites=13601267723412168587&as_sdt=2005&sciodt=0,5&hl=en",1,"2021-12-18 18:47:17","","","","",,,,,253,63.25,127,2,4,"Vehicular ad hoc networks (VANETs) have become one of the most promising and fastest growing subsets of mobile ad hoc networks (MANETs). They are comprised of smart vehicles and roadside units (RSU) which communicate through unreliable wireless media …","https://www.academia.edu/download/56223631/A_survey_of_attacks_and_detection_mechanisms_on_intelligent_transportation_systems__VANETs_and_IoV.pdf","https://scholar.google.com/scholar?q=related:i9_3jO5owbwJ:scholar.google.com/&scioq=&hl=en&as_sdt=2005&sciodt=0,5"
142,"OA Wahab, J Bentahar, H Otrok, A Mourad","A survey on trust and reputation models for Web services: Single, composite, and communities",2015,"Decision Support Systems","Elsevier","https://www.sciencedirect.com/science/article/pii/S0167923615000809","https://scholar.google.com/scholar?cites=5290994742990588926&as_sdt=2005&sciodt=0,5&hl=en",2,"2021-12-18 18:47:17","","","","",,,,,142,23.67,36,4,6,"Web service selection constitutes nowadays a major challenge that is still attracting the research community to work on and investigate. The problem arises since decision makers (1) cannot blindly trust the service or its provider, and (2) ignore the environment within …","https://www.academia.edu/download/39514781/Survey.pdf","https://scholar.google.com/scholar?q=related:_stplK9jbUkJ:scholar.google.com/&scioq=&hl=en&as_sdt=2005&sciodt=0,5"
92,"OA Wahab, A Mourad, H Otrok, J Bentahar","CEAP: SVM-based intelligent detection model for clustered vehicular ad hoc networks",2016,"Expert Systems with …","Elsevier","https://www.sciencedirect.com/science/article/pii/S0957417415008088","https://scholar.google.com/scholar?cites=7230263194545355940&as_sdt=2005&sciodt=0,5&hl=en",3,"2021-12-18 18:47:17","","","","",,,,,92,18.40,23,4,5,"The infrastructureless and decentralized nature of Vehicular Ad Hoc Network (VANET) makes it quite vulnerable to different types of malicious attacks. Detecting such attacks has attracted several contributions in the past few years. Nonetheless, the applicability of the …","https://www.researchgate.net/profile/Omar-Wahab/publication/288040297_CEAP_SVM-based_Intelligent_Detection_Model_for_Clustered_Vehicular_Ad_Hoc_Networks/links/5a74bd734585157306aa4bf9/CEAP-SVM-based-Intelligent-Detection-Model-for-Clustered-Vehicular-Ad-Hoc-Networks.pdf","https://scholar.google.com/scholar?q=related:pPx0XxEOV2QJ:scholar.google.com/&scioq=&hl=en&as_sdt=2005&sciodt=0,5"
62,"A Jesudoss, SVK Raja, A Sulaiman","Stimulating truth-telling and cooperation among nodes in VANETs through payment and punishment scheme",2015,"Ad Hoc Networks","Elsevier","https://www.sciencedirect.com/science/article/pii/S1570870514001929","https://scholar.google.com/scholar?cites=7519517151110540446&as_sdt=2005&sciodt=0,5&hl=en",4,"2021-12-18 18:47:17","","","","",,,,,62,10.33,21,3,6,"This paper proposes a Payment Punishment Scheme (PPS) working along with various established models to encourage truth telling during election process of the nodes in a cluster, motivate individual nodes in a cluster to cooperate and stimulate the nodes to …","","https://scholar.google.com/scholar?q=related:nqxmQgKxWmgJ:scholar.google.com/&scioq=&hl=en&as_sdt=2005&sciodt=0,5"
49,"DT Hoang, X Lu, D Niyato, P Wang, ...","Applications of repeated games in wireless networks: A survey",2015,"… Surveys & Tutorials","ieeexplore.ieee.org","https://ieeexplore.ieee.org/abstract/document/7124400/","https://scholar.google.com/scholar?cites=4757018729218932504&as_sdt=2005&sciodt=0,5&hl=en",5,"2021-12-18 18:47:17","","","","",,,,,49,8.17,10,5,6,"A repeated game is an effective tool to model interactions and conflicts for players aiming to achieve their objectives in a long-term basis. Contrary to static noncooperative games that model interactions among players in only one period, in repeated games, interactions of …","https://arxiv.org/pdf/1501.02886","https://scholar.google.com/scholar?q=related:GH_5mFRTBEIJ:scholar.google.com/&scioq=&hl=en&as_sdt=2005&sciodt=0,5"
40,"OA Wahab, J Bentahar, H Otrok, A Mourad","A Stackelberg game for distributed formation of business-driven services communities",2016,"Expert Systems with …","Elsevier","https://www.sciencedirect.com/science/article/pii/S0957417415006764","https://scholar.google.com/scholar?cites=12298431435642060327&as_sdt=2005&sciodt=0,5&hl=en",6,"2021-12-18 18:47:17","","","","",,,,,40,8.00,10,4,5,"With the advent of cloud computing and the rapid increase in the number of deployed services, the competition between functionally-similar Web services is increasingly governing the markets of services. For example, Amazon and Google are in an intense …","https://www.academia.edu/download/42396552/Stackelberg_Game.pdf","https://scholar.google.com/scholar?q=related:Jz7xFzvOrKoJ:scholar.google.com/&scioq=&hl=en&as_sdt=2005&sciodt=0,5"
30,"A Abusitta, M Bellaiche, ...","An SVM-based framework for detecting DoS attacks in virtualized clouds under changing environment",2018,"Journal of …","journalofcloudcomputing …","https://journalofcloudcomputing.springeropen.com/articles/10.1186/s13677-018-0109-4","https://scholar.google.com/scholar?cites=1947349434122766651&as_sdt=2005&sciodt=0,5&hl=en",7,"2021-12-18 18:47:17","HTML","10.1186/s13677-018-0109-4","","",,,,,30,10.00,10,3,3,"Cloud Computing enables providers to rent out space on their virtual and physical infrastructures. Denial of Service (DoS) attacks threaten the ability of the cloud to respond to clients requests, which results in considerable economic losses. The existing detection …","https://journalofcloudcomputing.springeropen.com/articles/10.1186/s13677-018-0109-4","https://scholar.google.com/scholar?q=related:OwlyKv5fBhsJ:scholar.google.com/&scioq=&hl=en&as_sdt=2005&sciodt=0,5"
22,"LC Hua, MH Anisi, L Yee, M Alam","Social networking-based cooperation mechanisms in vehicular ad-hoc network—a survey",2017,"Vehicular Communications","Elsevier","https://www.sciencedirect.com/science/article/pii/S2214209617300992","https://scholar.google.com/scholar?cites=13998128454142444707&as_sdt=2005&sciodt=0,5&hl=en",8,"2021-12-18 18:47:17","","","","",,,,,22,5.50,6,4,4,"Abstract Vehicular Ad-hoc Network (VANET) is a sub-class of Mobile Ad-hoc Networks (MANETs) where it is built up by moving vehicles. VANET is getting increasingly popular in traffic management especially in some of the developed countries. It can be categorized into …","","https://scholar.google.com/scholar?q=related:o8Ry7alXQ8IJ:scholar.google.com/&scioq=&hl=en&as_sdt=2005&sciodt=0,5"
22,"B Subba, S Biswas, S Karmakar","A game theory based multi layered intrusion detection framework for wireless sensor networks",2018,"International Journal of Wireless …","Springer","https://link.springer.com/article/10.1007/s10776-018-0403-6","https://scholar.google.com/scholar?cites=16979918197941544194&as_sdt=2005&sciodt=0,5&hl=en",9,"2021-12-18 18:47:17","","10.1007/s10776-018-0403-6","","",,,,,22,7.33,7,3,3,"Most of the existing intrusion detection frameworks proposed for wireless sensor networks (WSNs) are computation and energy intensive, which adversely affect the overall lifetime of the WSNs. In addition, some of these frameworks generate a significant volume of IDS traffic …","","https://scholar.google.com/scholar?q=related:AiV_N6PJpOsJ:scholar.google.com/&scioq=&hl=en&as_sdt=2005&sciodt=0,5"
22,"A Al-Hilo, M Samir, C Assi, ...","UAV-assisted content delivery in intelligent transportation systems-joint trajectory planning and cache management",2020,"IEEE Transactions …","ieeexplore.ieee.org","https://ieeexplore.ieee.org/abstract/document/9190025/","https://scholar.google.com/scholar?cites=6029044875796631760&as_sdt=2005&sciodt=0,5&hl=en",13,"2021-12-18 18:47:17","","","","",,,,,22,22.00,6,4,1,"Unmanned Aerial Vehicles (UAVs) are gaining growing interests due to the paramount roles they play, particularly these days, in enabling new services that help modernize our transportation, supply chain, search and rescue, among others. They are capable of …","","https://scholar.google.com/scholar?q=related:0FC_DF94q1MJ:scholar.google.com/&scioq=&hl=en&as_sdt=2005&sciodt=0,5"
17,"D Al-Terri, H Otrok, H Barada, M Al-Qutayri, ...","Cooperative based tit-for-tat strategies to retaliate against greedy behavior in VANETs",2017,"Computer …","Elsevier","https://www.sciencedirect.com/science/article/pii/S0140366417301822","https://scholar.google.com/scholar?cites=3385673362601361995&as_sdt=2005&sciodt=0,5&hl=en",10,"2021-12-18 18:47:17","","","","",,,,,17,4.25,3,5,4,"In this paper, we address the problem of greediness in IEEE 802.11 CSMA/CA protocol in Vehicular Ad-hoc Networks (VANETs). In VANETs some nodes might misbehave by deviating from following the CSMA/CA standard medium access protocol, in order to …","","https://scholar.google.com/scholar?q=related:S0JbN_xT_C4J:scholar.google.com/&scioq=&hl=en&as_sdt=2005&sciodt=0,5"
16,"A El Khatib, A Mourad, H Otrok, ...","A cooperative detection model based on artificial neural network for VANET QoS-OLSR protocol",2015,"2015 IEEE …","ieeexplore.ieee.org","https://ieeexplore.ieee.org/abstract/document/7324400/","https://scholar.google.com/scholar?cites=9906976670691236544&as_sdt=2005&sciodt=0,5&hl=en",11,"2021-12-18 18:47:17","","","","",,,,,16,2.67,4,4,6,"In this paper, we address the problem of detecting misbehaving vehicles in Vehicular Ad-Hoc Network using VANET QoS-OLSR, Quality of Service-Optimized Link State Routing protocol. VANET QoS-OLSR is a clustering protocol that is able to increase the stability of …","https://laur.lau.edu.lb:8443/xmlui/bitstream/handle/10725/5345/%28Postprint%29%20A%20cooperative.pdf?sequence=3&isAllowed=y","https://scholar.google.com/scholar?q=related:wBqi5sqmfIkJ:scholar.google.com/&scioq=&hl=en&as_sdt=2005&sciodt=0,5"
16,"FA Ghaleb, MA Maarof, A Zainal, MA Rassam, ...","Context-aware data-centric misbehaviour detection scheme for vehicular ad hoc networks using sequential analysis of the temporal and spatial correlation of the …",2019,"Vehicular …","Elsevier","https://www.sciencedirect.com/science/article/pii/S2214209619302335","https://scholar.google.com/scholar?cites=15621017830717061631&as_sdt=2005&sciodt=0,5&hl=en",12,"2021-12-18 18:47:17","","","","",,,,,16,8.00,3,5,2,"Abstract Vehicular ad hoc Networks (VANETs) have emerged mainly to improve road safety, traffic efficiency, and passenger comfort. The performance of most VANET applications and services relies on the availability of accurate and up-to-date mobility-information, through so …","https://arxiv.org/pdf/1904.01392","https://scholar.google.com/scholar?q=related:__nuDfQAydgJ:scholar.google.com/&scioq=&hl=en&as_sdt=2005&sciodt=0,5"
11,"D Dash","Approximation algorithm for data gathering from mobile sensors",2018,"Pervasive and Mobile Computing","Elsevier","https://www.sciencedirect.com/science/article/pii/S1574119217304819","https://scholar.google.com/scholar?cites=6345251734685219514&as_sdt=2005&sciodt=0,5&hl=en",14,"2021-12-18 18:47:17","","","","",,,,,11,3.67,11,1,3,"Abstract In Wireless Sensor Network (WSN), sensors are deployed to sense useful data from environment. To prolong the sensor network lifetime in large-scale network, mobile sinks are employed for collecting data from the sensors directly. The major drawback of the system is …","","https://scholar.google.com/scholar?q=related:uvpXiNXcDlgJ:scholar.google.com/&scioq=&hl=en&as_sdt=2005&sciodt=0,5"
6,"R Sultana, J Grover, M Tripathi","Security of sdn-based vehicular ad hoc networks: State-of-the-art and challenges",2021,"Vehicular Communications","Elsevier","https://www.sciencedirect.com/science/article/pii/S2214209620300553","https://scholar.google.com/scholar?cites=16566429271889927000&as_sdt=2005&sciodt=0,5&hl=en",15,"2021-12-18 18:47:17","","","","",,,,,6,6.00,2,3,1,"Abstract Development of Software Defined Networking (SDN) based Vehicular Ad Hoc Networks (VANETs) is one of the key enablers of 5G technology. VANETs enable different types of services through communication between vehicles and road side units. Intelligent …","","https://scholar.google.com/scholar?q=related:WNuha6bH5-UJ:scholar.google.com/&scioq=&hl=en&as_sdt=2005&sciodt=0,5"
6,"X Li, J Wang","A generous cooperative routing protocol for vehicle-to-vehicle networks",2016,"KSII Transactions on Internet and Information …","koreascience.or.kr","https://www.koreascience.or.kr/article/JAKO201607959403848.page","https://scholar.google.com/scholar?cites=10155405643656116179&as_sdt=2005&sciodt=0,5&hl=en",16,"2021-12-18 18:47:17","","","","",,,,,6,1.20,3,2,5,"In vehicle-to-vehicle (V2V) networks, where selfishness degrades node activity, countermeasures for collaboration enforcement must be provided to enable application of a sage and efficient network environment. Because vehicular networks feature both high …","https://www.koreascience.or.kr/article/JAKO201607959403848.pdf","https://scholar.google.com/scholar?q=related:07celKA_74wJ:scholar.google.com/&scioq=&hl=en&as_sdt=2005&sciodt=0,5"
5,"Z Hassan, A Mehmood, C Maple, MA Khan, ...","Intelligent Detection of Black Hole Attacks for Secure Communication in Autonomous and Connected Vehicles",2020,"IEEE …","ieeexplore.ieee.org","https://ieeexplore.ieee.org/abstract/document/9241834/","https://scholar.google.com/scholar?cites=5222205928474224892&as_sdt=2005&sciodt=0,5&hl=en",20,"2021-12-18 18:47:17","","","","",,,,,5,5.00,1,5,1,"Detection of Black Hole attacks is one of the most challenging and critical routing security issues in vehicular ad hoc networks (VANETs) and autonomous and connected vehicles (ACVs). Malicious vehicles or nodes may exist in the cyber-physical path on which the data …","https://ieeexplore.ieee.org/iel7/6287639/8948470/09241834.pdf","https://scholar.google.com/scholar?q=related:_Cilnp8AeUgJ:scholar.google.com/&scioq=&hl=en&as_sdt=2005&sciodt=0,5"
4,"J Wang, N He, F Mei, D Tian, Y Ge","Optimization and non-cooperative game of anonymity updating in vehicular networks",2019,"Ad Hoc Networks","Elsevier","https://www.sciencedirect.com/science/article/pii/S1570870518303846","https://scholar.google.com/scholar?cites=1737970964765144949&as_sdt=2005&sciodt=0,5&hl=en",17,"2021-12-18 18:47:17","","","","",,,,,4,2.00,1,5,2,"In vehicular ad-hoc networks, a large number of vehicles in mix-zones can increase privacy but at the expense of losing communication quality. Thus, it is necessary to harmonize these two conflicting goals for privacy protection. In this study, we propose an internal optimization …","","https://scholar.google.com/scholar?q=related:dffEYGKDHhgJ:scholar.google.com/&scioq=&hl=en&as_sdt=2005&sciodt=0,5"
3,"M Kadadha, H Otrok","A blockchain-enabled relay selection for QoS-OLSR in urban VANET: A Stackelberg game model",2021,"Ad Hoc Networks","Elsevier","https://www.sciencedirect.com/science/article/pii/S1570870521000615","https://scholar.google.com/scholar?cites=6939091684872928528&as_sdt=2005&sciodt=0,5&hl=en",21,"2021-12-18 18:47:17","","","","",,,,,3,3.00,2,2,1,"In this paper, a blockchain-enabled Stackelberg game model is proposed for the Quality-of-Service Optimized Link State Routing (QoS-OLSR) protocol in urban VANET. While QoS-OLSR protocols introduce game models, Stackelberg in specific, to select stable relays, the …","https://www.researchgate.net/profile/Maha-Kadadha/publication/350611966_A_blockchain-enabled_relay_selection_for_QoS-OLSR_in_urban_VANET_A_Stackelberg_game_model/links/60abb32592851ca9dcde542e/A-blockchain-enabled-relay-selection-for-QoS-OLSR-in-urban-VANET-A-Stackelberg-game-model.pdf","https://scholar.google.com/scholar?q=related:EL23XB-bTGAJ:scholar.google.com/&scioq=&hl=en&as_sdt=2005&sciodt=0,5"
2,"S Nobahary, H Gharaee Garakani, ...","ISOT: distributed selfish node detection in internet of things",2018,"… of Information & …","iranjournals.nlai.ir","https://iranjournals.nlai.ir/handle/123456789/554605","https://scholar.google.com/scholar?cites=13709006564617328241&as_sdt=2005&sciodt=0,5&hl=en",18,"2021-12-18 18:47:17","","","","",,,,,2,0.67,1,3,3,"Internet of Things (IOT) has prepared for a range of small sensors to popular laptops. Wireless communication in IOT systems assumes the nodes as a terminal as well as a router which can transmit the data packets. However, individual nodes may refuse to cooperate …","https://iranjournals.nlai.ir/bitstream/handle/123456789/554605/4E25F4B27D02E34886350909D2BC819D.pdf?sequence=-1","https://scholar.google.com/scholar?q=related:cZaDS9YsQL4J:scholar.google.com/&scioq=&hl=en&as_sdt=2005&sciodt=0,5"
2,"J Liu, S Huang, H Xu, D Li, N Zhong, H Liu","Cooperation Promotion from the Perspective of Behavioral Economics: An Incentive Mechanism Based on Loss Aversion in Vehicular Ad-Hoc Networks",2021,"Electronics","mdpi.com","https://www.mdpi.com/967468","https://scholar.google.com/scholar?cites=14544517127132221312&as_sdt=2005&sciodt=0,5&hl=en",19,"2021-12-18 18:47:17","","","","",,,,,2,2.00,0,6,1,"As a special mobile ad-hoc network, Vehicular Ad-hoc Networks (VANETs) have the characteristics of high-speed movement, frequent topology changes, multi-hop routing, a lack of energy, storage space limitations, and the possible selfishness of the nodes. These …","https://www.mdpi.com/2079-9292/10/3/225/pdf","https://scholar.google.com/scholar?q=related:gA9NWESB2MkJ:scholar.google.com/&scioq=&hl=en&as_sdt=2005&sciodt=0,5"
2,"G Rehman, A Ghani, M Zubair, ...","SOS: Socially omitting selfishness in IoT for smart and connected communities",2020,"International Journal …","Wiley Online Library","https://onlinelibrary.wiley.com/doi/abs/10.1002/dac.4455","https://scholar.google.com/scholar?cites=14411441650399951287&as_sdt=2005&sciodt=0,5&hl=en",26,"2021-12-18 18:47:17","","10.1002/dac.4455","","",,,,,2,2.00,1,4,1,"Smart and connected communities (SCC) is an emerging field of internet of things (IoT), and it has potential applications to improve human life. The improvement may be in terms of preservation, revitalization, livability, and sustainability of a community. The resources of the …","https://arxiv.org/pdf/2004.08948","https://scholar.google.com/scholar?q=related:t7lbcdO5_8cJ:scholar.google.com/&scioq=&hl=en&as_sdt=2005&sciodt=0,5"
0,"FA Ghaleb, MA Maarof, A Zainal, MA Rassam, F Saeed, ...","Vehicular Communications",2019,"","","","",22,"2021-12-18 18:47:17","CITATION","","","",,,,,0,0.00,0,6,2,"","","https://scholar.google.com/scholar?q=related:hflJNVsw-vsJ:scholar.google.com/&scioq=&hl=en&as_sdt=2005&sciodt=0,5"
0,"AMA Al-Hilo","Towards Smart Vehicular Environments via Deep Learning and Emerging Technologies",2021,"","spectrum.library.concordia.ca","https://spectrum.library.concordia.ca/id/eprint/988483/","",23,"2021-12-18 18:47:17","","","","",,,,,0,0.00,0,1,1,"Intelligent Transportation Systems (ITS) embrace smart vehicular environments through a fully connected paradigm known as vehicular networks. Vehicular networks allow automobiles to stay online and connected with their surroundings while travelling. In that …","https://spectrum.library.concordia.ca/id/eprint/988483/1/Alhilo_PhD_F2021.pdf",""
0,"L Misgan, A Chekol","Cooperation Methods in Vehicular Social Networking: A Survey",,"researchgate.net","","https://www.researchgate.net/profile/Lema-Misgan/publication/341827730_Cooperation_Methods_in_Vehicular_Social_Networking_A_Survey/links/5ed64cf04585152945282783/Cooperation-Methods-in-Vehicular-Social-Networking-A-Survey.pdf","",24,"2021-12-18 18:47:17","PDF","","","",,,,,0,0.00,0,2,,"The main objective of this paper is to fill the gap of the current state of the arts in vehicular social networking cooperation methods and to indicate open issues that researchers should work on. Vehicular Social Network (VSN) is a cutting-edge communication system that …","https://www.researchgate.net/profile/Lema-Misgan/publication/341827730_Cooperation_Methods_in_Vehicular_Social_Networking_A_Survey/links/5ed64cf04585152945282783/Cooperation-Methods-in-Vehicular-Social-Networking-A-Survey.pdf","https://scholar.google.com/scholar?q=related:8ILGVqkCqNgJ:scholar.google.com/&scioq=&hl=en&as_sdt=2005&sciodt=0,5"
0,"O Abdel Wahab, A Mourad, H Otrok, J Bentahar","CEAP",2016,"","laur.lau.edu.lb","https://laur.lau.edu.lb:8443/xmlui/handle/10725/5180","",25,"2021-12-18 18:47:17","","","","",,,,,0,0.00,0,4,5,"The infrastructureless and decentralized nature of Vehicular Ad Hoc Network (VANET) makes it quite vulnerable to different types of malicious attacks. Detecting such attacks has attracted several contributions in the past few years. Nonetheless, the applicability of the …","","https://scholar.google.com/scholar?q=related:U0P7cBnzDTkJ:scholar.google.com/&scioq=&hl=en&as_sdt=2005&sciodt=0,5"
0,"R Sultana, J Grover, M Tripathi","Vehicular Communications",2020,"","researchgate.net","https://www.researchgate.net/profile/Rukhsar-Sultana/publication/343703857_Security_of_SDN-based_vehicular_ad_hoc_networks_State-of-the-art_and_challenges/links/5fe16a2492851c13fead755f/Security-of-SDN-based-vehicular-ad-hoc-networks-State-of-the-art-and-challenges.pdf","",27,"2021-12-18 18:47:17","PDF","","","",,,,,0,0.00,0,3,1,"Security of SDN-based vehicular ad hoc networks: State-of-the-art and challenges Page 1 Vehicular Communications 27 (2021) 100284 Contents lists available at ScienceDirect Vehicular Communications www.elsevier.com/locate/vehcom Security of SDN-based vehicular …","https://www.researchgate.net/profile/Rukhsar-Sultana/publication/343703857_Security_of_SDN-based_vehicular_ad_hoc_networks_State-of-the-art_and_challenges/links/5fe16a2492851c13fead755f/Security-of-SDN-based-vehicular-ad-hoc-networks-State-of-the-art-and-challenges.pdf","https://scholar.google.com/scholar?q=related:SqBVoOzRUIYJ:scholar.google.com/&scioq=&hl=en&as_sdt=2005&sciodt=0,5"
0,"A Dua, N Kumar, S Bawa","Vehicular Communications",2014,"","researchgate.net","https://www.researchgate.net/profile/Hossein-Anisi-2/publication/320927426_Social_Networking-based_Cooperation_Mechanisms_in_Vehicular_Ad-Hoc_Network-_A_Survey/links/5a201bbdaca272088b23feca/Social-Networking-based-Cooperation-Mechanisms-in-Vehicular-Ad-Hoc-Network-A-Survey.pdf","",28,"2021-12-18 18:47:17","PDF","","","",,,,,0,0.00,0,3,7,"Social networking-based cooperation mechanisms in vehicular ad-hoc network—a survey Page 1 Vehicular Communications 10 (2017) 57–73 Contents lists available at ScienceDirect Vehicular Communications www.elsevier.com/locate/vehcom Social …","https://www.researchgate.net/profile/Hossein-Anisi-2/publication/320927426_Social_Networking-based_Cooperation_Mechanisms_in_Vehicular_Ad-Hoc_Network-_A_Survey/links/5a201bbdaca272088b23feca/Social-Networking-based-Cooperation-Mechanisms-in-Vehicular-Ad-Hoc-Network-A-Survey.pdf","https://scholar.google.com/scholar?q=related:gB3coFC1YNQJ:scholar.google.com/&scioq=&hl=en&as_sdt=2005&sciodt=0,5"
0,"A Abusitta","Theoretical and Applied Foundations for Intrusion Detection in Single and Federated Clouds",2018,"","search.proquest.com","https://search.proquest.com/openview/f3f2e7ddccd2f0faabe9a78721800f4c/1?pq-origsite=gscholar&cbl=18750&diss=y","",29,"2021-12-18 18:47:17","","","","",,,,,0,0.00,0,1,3,"Les systèmes infonuagiques deviennent de plus en plus complexes, plus dynamiques et hétérogènes. Un tel environnement produit souvent des données complexes et bruitées, empêchant les systèmes de détection d'intrusion (IDS) de détecter des variantes d'attaques …","https://publications.polymtl.ca/3714/1/2018_AdelAbusitta.pdf","https://scholar.google.com/scholar?q=related:L9MHyd7A1XMJ:scholar.google.com/&scioq=&hl=en&as_sdt=2005&sciodt=0,5"
0,"O Abdul Wahab","Game-Theoretic Foundations for Forming Trusted Coalitions of Multi-Cloud Services in the Presence of Active and Passive Attacks",2017,"","spectrum.library.concordia.ca","https://spectrum.library.concordia.ca/983298/","",30,"2021-12-18 18:47:17","","","","",,,,,0,0.00,0,1,4,"The prominence of cloud computing as a common paradigm for offering Web-based services has led to an unprecedented proliferation in the number of services that are deployed in cloud data centers. In parallel, services' communities and cloud federations …","https://spectrum.library.concordia.ca/983298/1/AbdulWahab_PhD_S2018.pdf","https://scholar.google.com/scholar?q=related:Zq5u55fPdtYJ:scholar.google.com/&scioq=&hl=en&as_sdt=2005&sciodt=0,5"
