Cites,Authors,Title,Year,Source,Publisher,ArticleURL,CitesURL,GSRank,QueryDate,Type,DOI,ISSN,CitationURL,Volume,Issue,StartPage,EndPage,ECC,CitesPerYear,CitesPerAuthor,AuthorCount,Age,Abstract,FullTextURL,RelatedURL
1,"O Omoruyi, E Chinomona","Modeling the Factors that Influence Employee Attitude and Service Delivery Behavior among Higher Education Professionals",2016,"Journal of Economics and …","ojs.amhinternational.com","https://ojs.amhinternational.com/index.php/jebs/article/view/1439","https://scholar.google.com/scholar?cites=7140515272237330265&as_sdt=2005&sciodt=0,5&hl=en",37,"2021-12-18 20:44:32","","","","",,,,,1,0.20,1,2,5,"Good and well calculated service delivery is very essential for the smooth running of institutions and for life long learning of students. Looking at factors that lead to employee attitude and service delivery bevaviour helps the higher education professionals to build a …","https://ojs.amhinternational.com/index.php/jebs/article/download/1439/1324","https://scholar.google.com/scholar?q=related:WS_12s40GGMJ:scholar.google.com/&scioq=&hl=en&as_sdt=2005&sciodt=0,5"
0,"J Wang, H Chen, R Jiang, X Li, Z Li","Fast Algorithms for Stackelberg Prediction Game with Least Squares Loss",2021,"arXiv preprint arXiv:2105.05531","arxiv.org","https://arxiv.org/abs/2105.05531","",26,"2021-12-18 20:44:32","","","","",,,,,0,0.00,0,5,1,"The Stackelberg prediction game (SPG) has been extensively used to model the interactions between the learner and data provider in the training process of various machine learning algorithms. Particularly, SPGs played prominent roles in cybersecurity applications, such as …","https://arxiv.org/pdf/2105.05531","https://scholar.google.com/scholar?q=related:1iBYPNGsZCMJ:scholar.google.com/&scioq=&hl=en&as_sdt=2005&sciodt=0,5"
0,"OP Cedeño-Fuentes¹, L Arboleda-Castro, ...","Optimización de modelos de Stackelberg no estacionarios mediante un algoritmo evolutivo auto-adaptativo",2017,"TecnoLógicas","scielo.org.co","http://www.scielo.org.co/scielo.php?pid=S0123-77992017000200013&script=sci_abstract&tlng=en","",30,"2021-12-18 20:44:32","","","","",,,,,0,0.00,0,3,4,"Abstract CEDENO-FUENTES¹, Olga P.; ARBOLEDA-CASTRO, Lorena; JACHO-SANCHEZ, Iván and NOVOA-HERNANDEZ, Pavel. Optimization of non-stationary Stackelberg models using a self-adaptive evolutionary algorithm. TecnoL.[online]. 2017, vol. 20, n. 39, pp. 187 …","http://www.scielo.org.co/pdf/teclo/v20n39/v20n39a13.pdf","https://scholar.google.com/scholar?q=related:87j8W9u2rzEJ:scholar.google.com/&scioq=&hl=en&as_sdt=2005&sciodt=0,5"
0,"M Taghavi","Strategic and Blockchain-based Market Decisions for Cloud Computing",2021,"","spectrum.library.concordia.ca","https://spectrum.library.concordia.ca/id/eprint/988355/","",31,"2021-12-18 20:44:32","","","","",,,,,0,0.00,0,1,1,"The cloud computing market has been in the center of attention for years where cloud providers strive to survive by either competition or cooperation. Some cloud providers choose to compete in the market that is dominated by few large providers and try to …","https://spectrum.library.concordia.ca/id/eprint/988355/1/Taghavi_PhD_F2021.pdf",""
0,"F Eltayesh","Verifiable Outsourced Database Model: A Game-Theoretic Approach",2017,"","spectrum.library.concordia.ca","https://spectrum.library.concordia.ca/982103/1/Eltayesh_MASc_S2017.pdf","",32,"2021-12-18 20:44:32","PDF","","","",,,,,0,0.00,0,1,4,"In the verifiable database (VDB) model, a computationally weak client (database owner) delegates his database management to a database service provider on the cloud, which is considered untrusted third party, while users can query the data and verify the integrity of …","https://spectrum.library.concordia.ca/982103/1/Eltayesh_MASc_S2017.pdf","https://scholar.google.com/scholar?q=related:mbRjhmr-I_8J:scholar.google.com/&scioq=&hl=en&as_sdt=2005&sciodt=0,5"
0,"O Abdul Wahad, J Bentahar, H Otrok, A Mourad","Towards trustworthy multi-cloud services communities",2016,"","laur.lau.edu.lb","https://laur.lau.edu.lb:8443/xmlui/handle/10725/5184","",33,"2021-12-18 20:44:32","","","","",,,,,0,0.00,0,4,5,"The prominence of cloud computing led to unprecedented proliferation in the number of Web services deployed in cloud data centers. In parallel, service communities have gained recently increasing interest due to their ability to facilitate discovery, composition, and …","https://laur.lau.edu.lb:8443/xmlui/bitstream/handle/10725/5184/%28Postprint%29%20Towards.pdf?sequence=3&isAllowed=y","https://scholar.google.com/scholar?q=related:rnU2khlgke8J:scholar.google.com/&scioq=&hl=en&as_sdt=2005&sciodt=0,5"
0,"L Arboleda-Castro, O Cedeño-Fuentes, ...","An evolutionary computational approach for the dynamic Stackelberg competition problems",2016,"Enfoque …","scielo.senescyt.gob.ec","http://scielo.senescyt.gob.ec/scielo.php?script=sci_abstract&pid=S1390-65422016000200010&lng=en&nrm=iso&tlng=en","",34,"2021-12-18 20:44:32","","","","",,,,,0,0.00,0,3,5,"Abstract ARBOLEDA-CASTRO, Lorena; CEDENO-FUENTES, Olga; JACHO-SANCHEZ, Iván and NOVOA-HERNANDEZ, Pavel. An evolutionary computational approach for the dynamic Stackelberg competition problems. Enfoque UTE [online]. 2016, vol. 7, n. 2, pp. 10-24. ISSN …","","https://scholar.google.com/scholar?q=related:laKMmkyhMmIJ:scholar.google.com/&scioq=&hl=en&as_sdt=2005&sciodt=0,5"
0,"O Abdel Wahab, J Bentahar, H Otrok, A Mourad","I know you are watching me",2017,"","laur.lau.edu.lb","https://laur.lau.edu.lb:8443/xmlui/handle/10725/8322","",36,"2021-12-18 20:44:32","","","","",,,,,0,0.00,0,4,4,"Insider attacks in which misbehaving Virtual Machines (VMs) take part of the cloud system and learn about its internal vulnerabilities constitute a major threat against cloud resources and infrastructure. This demands setting up continuous and comprehensive security …","https://laur.lau.edu.lb:8443/xmlui/bitstream/handle/10725/8322/(Postprint)%20I%20know.pdf?sequence=3","https://scholar.google.com/scholar?q=related:3ywqvINvlo4J:scholar.google.com/&scioq=&hl=en&as_sdt=2005&sciodt=0,5"
0,"O Abdul Wahab","Game-Theoretic Foundations for Forming Trusted Coalitions of Multi-Cloud Services in the Presence of Active and Passive Attacks",2017,"","spectrum.library.concordia.ca","https://spectrum.library.concordia.ca/983298/","",38,"2021-12-18 20:44:32","","","","",,,,,0,0.00,0,1,4,"The prominence of cloud computing as a common paradigm for offering Web-based services has led to an unprecedented proliferation in the number of services that are deployed in cloud data centers. In parallel, services' communities and cloud federations …","https://spectrum.library.concordia.ca/983298/1/AbdulWahab_PhD_S2018.pdf","https://scholar.google.com/scholar?q=related:Zq5u55fPdtYJ:scholar.google.com/&scioq=&hl=en&as_sdt=2005&sciodt=0,5"
0,"BC Chung, DH Cho","Learning-based resource partitioning in heterogeneous networks with multiple network operators",2020,"IEEE Communications Letters","ieeexplore.ieee.org","https://ieeexplore.ieee.org/abstract/document/9253681/","",39,"2021-12-18 20:44:32","","","","",,,,,0,0.00,0,2,1,"In heterogeneous network, it is important to mitigate cross-tier interference. Resource partitioning is the one of solution to reduce interference. However, most of studies on partitioning assumed that there was only one network operator to cooperate with. In this …","","https://scholar.google.com/scholar?q=related:ocWL7AoW0LkJ:scholar.google.com/&scioq=&hl=en&as_sdt=2005&sciodt=0,5"
0,"M Kadadha, H Otrok, H Barada, M Al-Qutayri, ...","Vehicular Communications",2018,"","researchgate.net","https://www.researchgate.net/profile/H-Barada/publication/325443935_A_Stackelberg_game_for_street-centric_QoS-OLSR_protocol_in_urban_Vehicular_Ad_Hoc_Networks/links/5b166ace4585151f91fb8457/A-Stackelberg-game-for-street-centric-QoS-OLSR-protocol-in-urban-Vehicular-Ad-Hoc-Networks.pdf","",40,"2021-12-18 20:44:32","PDF","","","",,,,,0,0.00,0,5,3,"A Stackelberg game for street-centric QoS-OLSR protocol in urban Vehicular Ad Hoc Networks Page 1 Vehicular Communications 13 (2018) 64–77 Contents lists available at ScienceDirect Vehicular Communications www.elsevier.com/locate/vehcom A Stackelberg game for …","https://www.researchgate.net/profile/H-Barada/publication/325443935_A_Stackelberg_game_for_street-centric_QoS-OLSR_protocol_in_urban_Vehicular_Ad_Hoc_Networks/links/5b166ace4585151f91fb8457/A-Stackelberg-game-for-street-centric-QoS-OLSR-protocol-in-urban-Vehicular-Ad-Hoc-Networks.pdf","https://scholar.google.com/scholar?q=related:jWy6_sAf1hQJ:scholar.google.com/&scioq=&hl=en&as_sdt=2005&sciodt=0,5"
