Cites,Authors,Title,Year,Source,Publisher,ArticleURL,CitesURL,GSRank,QueryDate,Type,DOI,ISSN,CitationURL,Volume,Issue,StartPage,EndPage,ECC,CitesPerYear,CitesPerAuthor,AuthorCount,Age,Abstract,FullTextURL,RelatedURL
8,"S Zhang, X Xiao","Cscdroid: Accurately detect android malware via contribution-level-based system call categorization",2017,"2017 IEEE Trustcom/BigDataSE/ICESS","ieeexplore.ieee.org","https://ieeexplore.ieee.org/abstract/document/8029440/","https://scholar.google.com/scholar?cites=6707323703674277729&as_sdt=2005&sciodt=0,5&hl=en",1,"2021-12-18 23:14:28","","","","",,,,,8,2.00,4,2,4,"The detection of the malicious application or malware on Android platform is a very concerned issue. Many studies have demonstrated their effect from static property analysis and dynamic analysis. However, their accuracy and efficacy still cannot satisfy the demand …","","https://scholar.google.com/scholar?q=related:YQ8QH18zFV0J:scholar.google.com/&scioq=&hl=en&as_sdt=2005&sciodt=0,5"
6,"S Hutchinson, B Zhou, ...","Are we really protected? An investigation into the play protect service",2019,"2019 IEEE International …","ieeexplore.ieee.org","https://ieeexplore.ieee.org/abstract/document/9006100/","https://scholar.google.com/scholar?cites=6550948954507997840&as_sdt=2005&sciodt=0,5&hl=en",2,"2021-12-18 23:14:28","","","","",,,,,6,3.00,2,3,2,"Android smartphones are becoming more and more popular each year. With this increased user base, comes an increased need for Android OS to protect its users from malicious applications that may violate users' privacy. The Google Play Store is the main means of …","","https://scholar.google.com/scholar?q=related:kHIqn12l6VoJ:scholar.google.com/&scioq=&hl=en&as_sdt=2005&sciodt=0,5"
4,"W Song, J Zhang, J Huang","Servdroid: detecting service usage inefficiencies in android applications",2019,"Proceedings of the 2019 27th ACM Joint …","dl.acm.org","https://dl.acm.org/doi/abs/10.1145/3338906.3338950","https://scholar.google.com/scholar?cites=9032728829428492541&as_sdt=2005&sciodt=0,5&hl=en",3,"2021-12-18 23:14:28","","10.1145/3338906.3338950","","",,,,,4,2.00,1,3,2,"Services in Android applications are frequently-used components for performing time-consuming operations in the background. While services play a crucial role in the app performance, our study shows that service uses in practice are not as efficient as expected …","https://www.researchgate.net/profile/Wei-Song-37/publication/335091774_ServDroid_detecting_service_usage_inefficiencies_in_Android_applications/links/5d73d9e1299bf1cb808fe60b/ServDroid-detecting-service-usage-inefficiencies-in-Android-applications.pdf","https://scholar.google.com/scholar?q=related:_eiDTgOzWn0J:scholar.google.com/&scioq=&hl=en&as_sdt=2005&sciodt=0,5"
3,"S Hutchinson, U Karabiyik","Forensic analysis of spy applications in android devices",2019,"","commons.erau.edu","https://commons.erau.edu/adfsl/2019/paper-presentation/3/","https://scholar.google.com/scholar?cites=10348863350256231001&as_sdt=2005&sciodt=0,5&hl=en",4,"2021-12-18 23:14:28","","","","",,,,,3,1.50,2,2,2,"Abstract Smartphones with Google's Android operating system are becoming more and more popular each year, and with this increased user base, comes increased opportunities to collect more of these users' private data. There have been several instances of malware …","https://commons.erau.edu/cgi/viewcontent.cgi?article=1466&context=adfsl","https://scholar.google.com/scholar?q=related:WeIU7WKMno8J:scholar.google.com/&scioq=&hl=en&as_sdt=2005&sciodt=0,5"
1,"EW Burroughs","Pocket Sized Threats: Discussing Malware Attacks on Android Smartphones",2019,"","search.proquest.com","https://search.proquest.com/openview/5f0bc1dcc2706620a632a8e108f948f2/1?pq-origsite=gscholar&cbl=18750&diss=y","https://scholar.google.com/scholar?cites=11029407240241644214&as_sdt=2005&sciodt=0,5&hl=en",9,"2021-12-18 23:14:28","","","","",,,,,1,0.50,1,1,2,"Smartphones are a ubiquitous component of modern technology used by individual consumers, governments, and businesses to store vast amounts of sensitive data and perform various tasks. The Android mobile operating system made up 75% of the worldwide …","","https://scholar.google.com/scholar?q=related:toK53XJTEJkJ:scholar.google.com/&scioq=&hl=en&as_sdt=2005&sciodt=0,5"
1,"GAP Rodrigues, RDO Albuquerque, GDO Alves, ...","Securing Instant Messages With Hardware-Based Cryptography and Authentication in Browser Extension",2020,"IEEE …","ieeexplore.ieee.org","https://ieeexplore.ieee.org/abstract/document/9091122/","https://scholar.google.com/scholar?cites=8100980692890359079&as_sdt=2005&sciodt=0,5&hl=en",11,"2021-12-18 23:14:28","","","","",,,,,1,1.00,0,4,1,"Instant Messaging (IM) provides near-real-time communication between users, which has shown to be a valuable tool for internal communication in companies and for general-purpose interaction among people. IM systems and supporting protocols, however, must …","https://ieeexplore.ieee.org/iel7/6287639/8948470/09091122.pdf","https://scholar.google.com/scholar?q=related:JxUH9AR3bHAJ:scholar.google.com/&scioq=&hl=en&as_sdt=2005&sciodt=0,5"
0,"H Jia, Y Ding, Y Hu, Y Song","Cyber-Physical System Security",2020,"Energy Internet","Springer","https://link.springer.com/chapter/10.1007/978-3-030-45453-1_3","",5,"2021-12-18 23:14:28","","10.1007/978-3-030-45453-1_3","","",,,,,0,0.00,0,4,1,"The rapid development of advanced information technologies, for example, the Internet of Things and Big Data techniques, has made the energy internet achieve a deep integration of physical systems and cyber systems and realize an effective combination of energy flow and …","","https://scholar.google.com/scholar?q=related:4YqhOs6SRssJ:scholar.google.com/&scioq=&hl=en&as_sdt=2005&sciodt=0,5"
0,"FH Khan, M Haris","Evolution of Android Operating System: A Review",,"researchgate.net","","https://www.researchgate.net/profile/Farhan-Khan-33/publication/319617606_Evolution_of_Android_Operating_System_A_Review/links/5a7d97bf458515dea410e610/Evolution-of-Android-Operating-System-A-Review.pdf","",6,"2021-12-18 23:14:28","PDF","","","",,,,,0,0.00,0,2,,"In past mobile phones were used only to make calls but with the introduction of smartphone the mobile phone has evolved to a low powered hand held processing system. This evolution was caused by the operating system for the mobile phones making them smart that …","https://www.researchgate.net/profile/Farhan-Khan-33/publication/319617606_Evolution_of_Android_Operating_System_A_Review/links/5a7d97bf458515dea410e610/Evolution-of-Android-Operating-System-A-Review.pdf","https://scholar.google.com/scholar?q=related:07I9dt18fn4J:scholar.google.com/&scioq=&hl=en&as_sdt=2005&sciodt=0,5"
0,"S TASDEMİR, A CALİSKAN","A Practical Approach to Android Mobile Application Security",,"International Journal of Applied Mathematics …","dergipark.org.tr","https://dergipark.org.tr/en/pub/ijamec/issue/41654/467450","",7,"2021-12-18 23:14:28","","","","",,,,,0,0.00,0,2,,"In parallel to rapid developments in computer technology, the number of mobile applications developed for the devices also increases. Mobile applications make life easier, but also bring some risks. These applications may create some weaknesses due to mistakes in the …","https://dergipark.org.tr/en/download/article-file/609607","https://scholar.google.com/scholar?q=related:Zn6CgSH1eqEJ:scholar.google.com/&scioq=&hl=en&as_sdt=2005&sciodt=0,5"
0,"F Willems, M Raahemi, P Buddhitha, C Adams, ...","On the security and privacy of Interac e-Transfers",2019,"arXiv preprint arXiv …","arxiv.org","https://arxiv.org/abs/1910.01587","",8,"2021-12-18 23:14:28","","","","",,,,,0,0.00,0,5,2,"Nowadays, the Interac e-Transfer is one of the most important remote payment methods for Canadian consumers. To the best of our knowledge, this paper is the very first to examine the privacy and security of Interac e-Transfers. Experimental results show that the …","https://arxiv.org/pdf/1910.01587","https://scholar.google.com/scholar?q=related:GnfMmUR-BWoJ:scholar.google.com/&scioq=&hl=en&as_sdt=2005&sciodt=0,5"
0,"B Athira, N Babu, MS Krishnan","An Inspective Mode to Find the Optimum Antivirus App for Defending the Latest Banking Tordow",2017,"International Journal of Pure and …","acadpubl.eu","http://www.acadpubl.eu/jsi/2017-114-7-ICPCIT-2017/articles/12/9.pdf","",10,"2021-12-18 23:14:28","PDF","","","",,,,,0,0.00,0,3,4,"The threat of banking Trojans, opens a wide range of new opportunities for the banned collection of private information in mobile banking. While existing work shows that such “Banking Trojans” drip the detection by various antivirus apps, diverts keystrokes, evades …","http://www.acadpubl.eu/jsi/2017-114-7-ICPCIT-2017/articles/12/9.pdf","https://scholar.google.com/scholar?q=related:bX6P6KEtSlcJ:scholar.google.com/&scioq=&hl=en&as_sdt=2005&sciodt=0,5"
