Cites,Authors,Title,Year,Source,Publisher,ArticleURL,CitesURL,GSRank,QueryDate,Type,DOI,ISSN,CitationURL,Volume,Issue,StartPage,EndPage,ECC,CitesPerYear,CitesPerAuthor,AuthorCount,Age,Abstract,FullTextURL,RelatedURL
25,"H Sami, A Mourad","Dynamic on-demand fog formation offering on-the-fly IoT service deployment",2020,"IEEE Transactions on Network and Service …","ieeexplore.ieee.org","https://ieeexplore.ieee.org/abstract/document/8947936/","https://scholar.google.com/scholar?cites=12896776782735051752&as_sdt=2005&sciodt=0,5&hl=en",1,"2021-12-19 16:35:42","","","","",,,,,25,25.00,13,2,1,"With the increasing number of IoT devices, fog computing has emerged, providing processing resources at the edge for the tremendous amount of sensed data and IoT computation. The advantage of the fog gets eliminated if it is not present near IoT devices …","https://www.academia.edu/download/64624911/DynamicOn-DemandFogFormationOfferingOn-The-FlyIoTServiceDeployment08947936.pdf","https://scholar.google.com/scholar?q=related:6IttYieO-rIJ:scholar.google.com/&scioq=&hl=en&as_sdt=2005&sciodt=0,5"
13,"H Sami, A Mourad, W El-Hajj","Vehicular-OBUs-as-on-demand-fogs: Resource and context aware deployment of containerized micro-services",2020,"IEEE/ACM Transactions on …","ieeexplore.ieee.org","https://ieeexplore.ieee.org/abstract/document/9032323/","https://scholar.google.com/scholar?cites=17947123205686221738&as_sdt=2005&sciodt=0,5&hl=en",2,"2021-12-19 16:35:42","","","","",,,,,13,13.00,4,3,1,"Observing the headway in vehicular industry, new applications are developed demanding more resources. For instance, real-time vehicular applications require fast processing of the vast amount of generated data by vehicles in order to maintain service availability and …","https://www.researchgate.net/profile/Hani-Sami-2/publication/339852675_Vehicular-OBUs-As-On-Demand-Fogs_Resource_and_Context_Aware_Deployment_of_Containerized_Micro-Services/links/5e83d92692851c2f5270dbab/Vehicular-OBUs-As-On-Demand-Fogs-Resource-and-Context-Aware-Deployment-of-Containerized-Micro-Services.pdf","https://scholar.google.com/scholar?q=related:qtsYt3f9EPkJ:scholar.google.com/&scioq=&hl=en&as_sdt=2005&sciodt=0,5"
12,"P Farhat, H Sami, A Mourad","Reinforcement R-learning model for time scheduling of on-demand fog placement",2020,"The Journal of Supercomputing","Springer","https://link.springer.com/article/10.1007/s11227-019-03032-z","https://scholar.google.com/scholar?cites=1383698678103651348&as_sdt=2005&sciodt=0,5&hl=en",3,"2021-12-19 16:35:42","","10.1007/s11227-019-03032-z","","",,,,,12,12.00,4,3,1,"On the fly deployment of fog nodes near users provides the flexibility of pushing services anywhere and whenever needed. Nevertheless, taking a real-life scenario, the cloud might limit the number of fogs to place for minimizing the complexity of monitoring a large number …","https://www.researchgate.net/profile/Hani-Sami-2/publication/336750483_Reinforcement_R-learning_model_for_time_scheduling_of_on-demand_fog_placement/links/5dd2d92592851c382f49a2c8/Reinforcement-R-learning-model-for-time-scheduling-of-on-demand-fog-placement.pdf","https://scholar.google.com/scholar?q=related:FLSL2J3iMxMJ:scholar.google.com/&scioq=&hl=en&as_sdt=2005&sciodt=0,5"
5,"H Sami, A Mourad, H Otrok, ...","Fscaler: Automatic resource scaling of containers in fog clusters using reinforcement learning",2020,"… and Mobile Computing …","ieeexplore.ieee.org","https://ieeexplore.ieee.org/abstract/document/9148401/","https://scholar.google.com/scholar?cites=3758340659779259874&as_sdt=2005&sciodt=0,5&hl=en",4,"2021-12-19 16:35:42","","","","",,,,,5,5.00,1,4,1,"Several studies leverage fog computing as a solution to overcome cloud delays, including computation, network, and data storage. Along with the increase in demands for computing resources in fog infrastructures, heterogeneous fog devices are used towards forming highly …","https://www.researchgate.net/profile/Azzam-Mourad/publication/343244224_FScaler_Automatic_Resource_Scaling_of_Containers_in_Fog_Clusters_Using_Reinforcement_Learning/links/5f95b5c2a6fdccfd7b7f6da9/FScaler-Automatic-Resource-Scaling-of-Containers-in-Fog-Clusters-Using-Reinforcement-Learning.pdf","https://scholar.google.com/scholar?q=related:4s0M4-pOKDQJ:scholar.google.com/&scioq=&hl=en&as_sdt=2005&sciodt=0,5"
4,"H Sami, A Mourad, H Otrok, ...","Demand-Driven Deep Reinforcement Learning for Scalable Fog and Service Placement",2021,"IEEE Transactions on …","ieeexplore.ieee.org","https://ieeexplore.ieee.org/abstract/document/9416796/","https://scholar.google.com/scholar?cites=8998968156978449359&as_sdt=2005&sciodt=0,5&hl=en",6,"2021-12-19 16:35:42","","","","",,,,,4,4.00,1,4,1,"The increasing number of Internet of Things (IoT) devices necessitates the need for a more substantial fog computing infrastructure to support the users' demand for services. In this context, the placement problem consists of selecting fog resources and mapping services to …","https://www.researchgate.net/profile/Hani-Sami-2/publication/351080915_Demand-Driven_Deep_Reinforcement_Learning_for_Scalable_Fog_and_Service_Placement/links/6083ac718ea909241e1ee47d/Demand-Driven-Deep-Reinforcement-Learning-for-Scalable-Fog-and-Service-Placement.pdf","https://scholar.google.com/scholar?q=related:z4vANdzB4nwJ:scholar.google.com/&scioq=&hl=en&as_sdt=2005&sciodt=0,5"
1,"I Alfonso, K Garcés, H Castro, J Cabot","Self-adaptive Architectures in IoT Systems: A Systematic Literature Review",2021,"arXiv preprint arXiv:2109.03312","arxiv.org","https://arxiv.org/abs/2109.03312","https://scholar.google.com/scholar?cites=9822829822760372515&as_sdt=2005&sciodt=0,5&hl=en",5,"2021-12-19 16:35:42","","","","",,,,,1,1.00,0,4,1,"Over the past few years, the relevance of the Internet of Things (IoT) has grown significantly and is now a key component of many industrial processes and even a transparent participant in various activities performed in our daily life. IoT systems are subjected to …","https://arxiv.org/pdf/2109.03312",""
0,"S Choudhary","Kubernetes-Based Architecture For An On-premises Machine Learning Platform",2021,"","aaltodoc.aalto.fi","https://aaltodoc.aalto.fi/handle/123456789/110516","",7,"2021-12-19 16:35:42","","","","",,,,,0,0.00,0,1,1,"This thesis introduces an architecture where a machine learning platform can be set up on an unmanaged Kubernetes cluster in an on-premises environment, using Kubeflow and Kubeflow Pipelines. The proposed architecture allows the solution to be platform-agnostic …","https://aaltodoc.aalto.fi/bitstream/handle/123456789/110516/master_Choudhary_Swati_2021.pdf?sequence=1&isAllowed=y",""
