Cites,Authors,Title,Year,Source,Publisher,ArticleURL,CitesURL,GSRank,QueryDate,Type,DOI,ISSN,CitationURL,Volume,Issue,StartPage,EndPage,ECC,CitesPerYear,CitesPerAuthor,AuthorCount,Age,Abstract,FullTextURL,RelatedURL
30,"T Dbouk, A Mourad, H Otrok, H Tout, ...","A novel ad-hoc mobile edge cloud offering security services through intelligent resource-aware offloading",2019,"IEEE Transactions on …","ieeexplore.ieee.org","https://ieeexplore.ieee.org/abstract/document/8823954/","https://scholar.google.com/scholar?cites=5805424266565913959&as_sdt=2005&sciodt=0,5&hl=en",1,"2021-12-19 16:35:34","","","","",,,,,30,15.00,6,5,2,"While the usage of smart devices is increasing, security attacks and malware affecting such terminals are briskly evolving as well. Mobile security suites exist to defend devices against malware and other intrusions. However, they require extensive resources not continuously …","https://laur.lau.edu.lb:8443/xmlui/bitstream/handle/10725/12695/%28Postprint%29%20A%20Novel.pdf?sequence=2&isAllowed=y","https://scholar.google.com/scholar?q=related:Zw0Yq5wCkVAJ:scholar.google.com/&scioq=&hl=en&as_sdt=2005&sciodt=0,5"
2,"S Kaddoura, RA Haraty, K Al Kontar, O Alfandi","A parallelized database damage assessment approach after cyberattack for healthcare systems",2021,"Future Internet","mdpi.com","https://www.mdpi.com/1054696","https://scholar.google.com/scholar?cites=5201452803370730560&as_sdt=2005&sciodt=0,5&hl=en",2,"2021-12-19 16:35:34","","","","",,,,,2,2.00,1,4,1,"In the current Internet of things era, all companies shifted from paper-based data to the electronic format. Although this shift increased the efficiency of data processing, it has security drawbacks. Healthcare databases are a precious target for attackers because they …","https://www.mdpi.com/1999-5903/13/4/90/pdf","https://scholar.google.com/scholar?q=related:QETfJMRFL0gJ:scholar.google.com/&scioq=&hl=en&as_sdt=2005&sciodt=0,5"
0,"Y Jebbar, N Promwongsa, F Belqasmi, ...","A Case Study on the Deployment of a Tactile Internet Application in a Hybrid Cloud, Edge, and Mobile Ad Hoc Cloud Environment",2021,"IEEE Systems …","ieeexplore.ieee.org","https://ieeexplore.ieee.org/abstract/document/9428631/","",3,"2021-12-19 16:35:34","","","","",,,,,0,0.00,0,4,1,"The tactile Internet is the next step after the Internet of Things (IoT). It enables the steering and control of virtual and real objects through the Internet and requires a very low round trip latency. This article is devoted to a case study on the deployment of a tactile Internet …","","https://scholar.google.com/scholar?q=related:TWYCgdlqlXcJ:scholar.google.com/&scioq=&hl=en&as_sdt=2005&sciodt=0,5"
0,"Y Jebbar","Remote Phobia Treatment as a Tactile Internet Application Case Study in Edge augmented with Mobile Ad Hoc Clouds Environment",2020,"","spectrum.library.concordia.ca","https://spectrum.library.concordia.ca/987070/","",4,"2021-12-19 16:35:34","","","","",,,,,0,0.00,0,1,1,"Tactile Internet is a next generation Internet that allows the transmission of haptic sensations in addition to audio and video content. It is expected to enable new latency-sensitive and critical use cases, such as remote phobia treatment, tele-surgery and autonomous driving …","https://spectrum.library.concordia.ca/987070/1/Jebbar_Master_S2020.pdf","https://scholar.google.com/scholar?q=related:-KwTuNrJa5sJ:scholar.google.com/&scioq=&hl=en&as_sdt=2005&sciodt=0,5"
0,"SA Alghamdi","Novel trust-aware intrusion detection and prevention system for 5G MANET–Cloud",2021,"International Journal of Information Security","Springer","https://link.springer.com/article/10.1007/s10207-020-00531-6","",5,"2021-12-19 16:35:34","","10.1007/s10207-020-00531-6","","",,,,,0,0.00,0,1,1,"Abstract 5G-based mobile ad hoc networks with cloud are a new paradigm that combines several real-world applications. Routing and security are current issues in MANETs. Security is highly important in MANET and cloud environments for preventing harmful attacks …","",""
0,"TH Dbouk","A novel mobile and vehicular Ad Hoc cloud framework for intursion detection.(c2017)",2017,"","laur.lau.edu.lb","https://laur.lau.edu.lb:8443/xmlui/handle/10725/6543","",6,"2021-12-19 16:35:34","","","","",,,,,0,0.00,0,1,4,"As the usage of smart-devices is increasing, security threats affecting the confidentiality, integrity, and privacy of such devices are briskly emerging due to the rapid growth of malware. Mobile security suites exist to defend devices against malware and other …","https://laur.lau.edu.lb:8443/xmlui/bitstream/handle/10725/6543/Toufic_H_Dbouk_Thesis_Redacted.pdf?sequence=1&isAllowed=y","https://scholar.google.com/scholar?q=related:CdehxaZW7qkJ:scholar.google.com/&scioq=&hl=en&as_sdt=2005&sciodt=0,5"
0,"NO Ogwara, K Petrova, M Loong, ...","Enhancing Data Security in the User Layer of Mobile Cloud Computing Environment: A Novel Approach",2020,"arXiv preprint arXiv …","arxiv.org","https://arxiv.org/abs/2012.08042","",7,"2021-12-19 16:35:34","","","","",,,,,0,0.00,0,4,1,"This paper reviews existing Intrusion Detection Systems (IDS) that target the Mobile Cloud Computing (MCC), Cloud Computing (CC), and Mobile Device (MD) environment. The review identifies the drawbacks in existing solutions and proposes a novel approach …","https://arxiv.org/pdf/2012.08042","https://scholar.google.com/scholar?q=related:1lHA1B7C1HYJ:scholar.google.com/&scioq=&hl=en&as_sdt=2005&sciodt=0,5"
0,"R Islambouli, Z Sweidan, A Mourad, ...","Towards Trust-Aware IoT Hashing Offloading in Mobile Edge Computing",2020,"2020 International …","ieeexplore.ieee.org","https://ieeexplore.ieee.org/abstract/document/9148480/","",8,"2021-12-19 16:35:34","","","","",,,,,0,0.00,0,4,1,"The massive increase of IoT connected devices is imposing various challenges at different dimensions due to the constrained capabilities of devices and huge requirements of applications. Attributed to the benefits it offers in terms of time and cost, pushing security …","https://www.researchgate.net/profile/Azzam-Mourad/publication/343249764_Towards_Trust-Aware_IoT_Hashing_Offloading_in_Mobile_Edge_Computing/links/5f95b2ca458515b7cf9e9e83/Towards-Trust-Aware-IoT-Hashing-Offloading-in-Mobile-Edge-Computing.pdf","https://scholar.google.com/scholar?q=related:J0Wq9O4_0-YJ:scholar.google.com/&scioq=&hl=en&as_sdt=2005&sciodt=0,5"
